{
  "contract_version": "1.0",
  "spec_id": "001-example",
  "spec_sha256": "aaaaaaaaaaaaaaaaaaaaaaaaaaaaaaaaaaaaaaaaaaaaaaaaaaaaaaaaaaaaaaaa",
  "contracts_sha256": {
    "contracts/C01-harness-config.schema.json": "bbbbbbbbbbbbbbbbbbbbbbbbbbbbbbbbbbbbbbbbbbbbbbbbbbbbbbbbbbbbbbbb"
  },
  "named_tests_sha256": {
    "tests/test_x.py": "0123456789abcdef0123456789abcdef0123456789abcdef0123456789abcdef"
  },
  "approved_by": "alex",
  "prompt_excerpt": "approve spec 001",
  "approved_at": "2026-10-11T12:00:00-03:00",
  "tool_version": "0.01.000"
}
