{
  "contract_version": "1.0",
  "spec_id": "001-example",
  "spec_sha256": "aaaaaaaaaaaaaaaaaaaaaaaaaaaaaaaaaaaaaaaaaaaaaaaaaaaaaaaaaaaaaaaa",
  "contracts_sha256": {},
  "named_tests_sha256": {},
  "approved_by": "alex",
  "prompt_excerpt": "approve spec 001",
  "approved_at": "2026-10-11T15:00:00Z",
  "tool_version": "0.01.000"
}
